topic_id,topic_name
0,"世界, 产品, 公司, 大会, 销量"
1,"哈尔滨, 新闻, 结弦, 羽生, 视频"
2,"尹锡悦, 总统, 政治, 生涯, 韩国"
3,"因果报应, 女儿, 父亲, 爸爸, 眼睛"
4,"团队, 明星, 粉丝, 网红, 视频"
5,"定义, 文化遗产, 物质, 计划, 项目"
6,"模样, 爱情, 现场, 精彩, 视频"
7,"张泽禹, 敦煌, 腾讯, 视频, 音乐"
8,"市场, 收盘, 特斯拉, 纳指, 美国"
9,"孙佳俊, 新闻, 江苏, 深圳, 集团"
10,"东西, 建筑, 故事, 讲坛, 风景"
11,"剧目, 科学家, 精神, 视频, 风采"
12,"产业, 代表, 北京, 号码, 科幻"
13,"女巫, 电影, 视频, 评论, 魔法"
14,"女性, 报告, 男人, 科学院, 音频"
15,"年度, 成都, 视频, 证明, 速度"
16,"啊啊啊, 安利, 宝宝, 西安, 视频"
17,"上线, 内蒙古, 朋友, 王一珩, 茶茶"
18,"同胞, 民族, 精神, 蒙古, 计划"
19,"专家, 交易, 人民日报, 心态, 情绪"
20,"中原, 人才, 利益, 明白, 董事长"
21,"利益, 剧组, 娱乐圈, 普通人, 阴阳"
22,"南宁, 手机, 演唱会, 现场, 视频"
23,"广州, 朋友, 消息, 爱情, 视频"
24,"上海, 人生, 原创, 女性, 正文"
25,"事件, 地方, 平台, 新闻, 行业"
26,"会员, 商品, 学生, 网页, 链接"
27,"专家, 科学, 视频, 记者, 身体"
28,"世界杯, 孙颖莎, 实力, 王楚钦, 神仙"
29,"a股, 世界, 博主, 视频, 财经"
30,"博主, 女生, 感觉, 男子, 老人"
31,"代表, 家庭, 小米, 汽车, 男孩"
32,"啊啊啊, 新加坡, 明星, 红毯, 赵丽颖"
33,"人生, 娱乐圈, 密码, 琼瑶, 科学"
34,"学会, 孩子, 家庭, 小学, 明白"
35,"侠之大者, 射雕, 电影, 肖战, 英雄传"
36,"学会, 指导, 材料, 杭州, 申报"
37,"中原, 协会, 河南省, 科普, 讲坛"
38,"城市, 女性, 技艺, 美食, 视频"
39,"东西, 事情, 内蒙古, 山东, 政治"
40,"全球, 数据, 比亚迪, 美国, 芯片"
41,"产品, 孙艺洲, 檀健, 滤镜, 身份"
42,"上市, 职业, 视频, 读书"
43,"世界, 人民日报, 仪式, 文明, 魏大勋"
44,"孩子, 政治, 歌手, 老师, 视频"
45,"上市, 吉利, 星舰, 汽车, 银河"
46,"作品, 品牌, 年轻人, 神仙, 读书"
47,"儿子, 公司, 品牌, 特斯拉, 马斯克"
48,"上线, 世界, 南京, 市民, 申报"
49,"上海, 公司, 科技, 行业, 视频"
50,"张凌赫, 明星, 红毯, 虞书欣, 速度"
51,故事
52,"兄弟, 力量, 机会, 视频"
53,"情况, 新能源, 汽车, 理想, 行业"
54,"世界杯, 日本, 法国, 混团, 韩国"
55,"医院, 娜娜, 父母, 读书, 账号"
56,"大学, 孤星, 王源, 王源超, 计划"
57,"事件, 卤味, 百味, 紫燕, 老爸"
58,"东杰, 王志恒, 股票, 行政处罚, 账户"
59,"市场, 收盘, 时刻, 男子, 行情"
60,"大学, 女子, 总统, 河南, 美国"
61,"手记, 视频, 读书"
62,"医生, 疾病, 老人, 计划, 音频"
63,视频
64,"作品, 号码, 周杰, 悼念, 琼瑶"
65,"仪式, 四川, 李子, 现场, 视频"
66,"情况, 板块, 熊猫, 科技, 视频"
67,"新能源, 汽车, 科技, 视频, 计划"
68,"人工智能, 全球, 品牌, 热议, 网友"
69,"上线, 易烊千玺, 浴池, 电影, 音乐会"
70,"世界, 女儿, 男子, 网友, 视频"
71,"政治, 新闻, 视频"
72,"华为, 安徽, 数字, 新质, 生产力"
73,"世界杯, 云顶, 李方慧, 滑雪, 谷爱凌"
74,"人生, 孩子, 文明, 纪录, 视频"
75,"东西, 孩子, 父母, 视频, 计划"
76,"人才, 全球, 公司, 文娱, 阿里"
77,"剧情, 感觉, 爱情, 视频, 读书"
78,"明白, 男人, 科技, 虞书欣, 视频"
79,"会议, 北京, 政治"
80,"体贴, 宋亚轩, 腾讯, 视频, 音乐"
81,"故事, 演技, 澳门, 爱情, 理想"
82,"商品, 数据, 财经, 黄金"
83,"安利, 真题, 答题, 粉丝, 精神"
84,"孤星, 影院, 爸爸, 电影, 计划"
85,"兄弟, 刘宇宁, 力量, 年度, 摩登"
